query,name,google_id,place_id,location_link,reviews_link,reviews,rating,review_id,review_pagination_id,author_link,author_title,author_id,author_image,author_reviews_count,author_ratings_count,review_text,review_img_urls,review_img_url,review_photo_ids,owner_answer,owner_answer_timestamp,owner_answer_timestamp_datetime_utc,review_link,review_rating,review_timestamp,review_datetime_utc,review_likes,reviews_id,reviews_per_score_1,reviews_per_score_2,reviews_per_score_3,reviews_per_score_4,reviews_per_score_5,review_questions_Layanan,review_questions_Jenis makanan,review_questions_Tarif per orang,review_questions_Makanan,review_questions_Suasana,review_questions_Rekomendasi hidangan,review_questions,review_questions_Tempat parkir,review_questions_None,review_questions_Parkir,review_questions_Opsi tempat parkir,review_questions_Opsi jenis parkir,review_questions_Batasan diet,review_questions_Kesesuaian untuk anak-anak,review_questions_Aksesibilitas kursi roda,review_questions_Pilihan menu vegetarian
0x2e69ef54401682e3:0xbec5a7f6b8e727aa,Kedai Roti Ibu Saya,0x2e69ef54401682e3:0xbec5a7f6b8e727aa,ChIJ44IWQFTvaS4RqifnuPanxb4,"https://www.google.com/maps/place/Kedai+Roti+Ibu+Saya/@-6.3574689,106.77544479999999,14z/data=!4m8!1m2!2m1!1sKedai+Roti+Ibu+Saya!3m4!1s0x2e69ef54401682e3:0xbec5a7f6b8e727aa!8m2!3d-6.3574689!4d106.77544479999999",https://search.google.com/local/reviews?placeid=ChIJ44IWQFTvaS4RqifnuPanxb4&q=*&authuser=0&hl=id&gl=US,1144,4.0,ChdDSUhNMG9nS0VJQ0FnSURUaS0tNHFRRRAB,CAESY0NBRVFBUnBFUTJwRlNVRlNTWEJEWjI5QlVEZGZURUZCYXpkZlgxOWZSV2hDYlhGbE5EazRla2xyY1ZWcFRGSXdjMEZCUVVGQlIyZHVPVEpRUVVOalJVOUVTMk5CV1VGRFNVRQ==,https://www.google.com/maps/contrib/111640775104286385301?hl=id,Eviana Rizki,111640775104286385301,https://lh3.googleusercontent.com/a-/ALV-UjWldsXlhVpSrLsZ_Cg2RNx2hipc1XCgEb_G68z5XHIKEy46L1w_=s120-c-rp-mo-ba5-br100,82,6,"Lokasi strategis, luas dan Asri. Banyak tersedia kursi baik indoor maupun outdoor. Ada 2 kasir yang juga di indoor dan outdoor.

Harga makanan murah dengan porsi kecil. Cocok untuk yang memang porsi kecil.

Rasa makanan lumayan, sesuai harga. Untuk teh tarik dan bubblegum segar tapi orange fresh terasa bangey sirup jeruk AB*.

Pelayanan lumayan. Makanan tiba 5-10 menit an dengan kondisi ramai sedang.

Parkir untuk mobil agak terbatas.","https://lh5.googleusercontent.com/p/AF1QipNYeUb13ueiozuvS4M0IkI1hWxDiZjtD-B9yeJo, https://lh5.googleusercontent.com/p/AF1QipOM2aASm-wE_Ds1tuE5F6yY9CwD5gZTAnyDVRN1, https://lh5.googleusercontent.com/p/AF1QipNSW5u9DMshn8yB-x85QapT-UE_Rx7OqmuDhtML, https://lh5.googleusercontent.com/p/AF1QipMR9QAmfUxSVbD-qGq1EpB2gzAHm_b0hFbLXXVj, https://lh5.googleusercontent.com/p/AF1QipPmmBQta0ntX336GKGGu2wuYgPk5qcfEnXJSeiq",https://lh5.googleusercontent.com/p/AF1QipNYeUb13ueiozuvS4M0IkI1hWxDiZjtD-B9yeJo=w150-h150-k-no-p,"AF1QipNYeUb13ueiozuvS4M0IkI1hWxDiZjtD-B9yeJo, AF1QipOM2aASm-wE_Ds1tuE5F6yY9CwD5gZTAnyDVRN1, AF1QipNSW5u9DMshn8yB-x85QapT-UE_Rx7OqmuDhtML, AF1QipMR9QAmfUxSVbD-qGq1EpB2gzAHm_b0hFbLXXVj, AF1QipPmmBQta0ntX336GKGGu2wuYgPk5qcfEnXJSeiq",,,,https://www.google.com/maps/reviews/data=!4m8!14m7!1m6!2m5!1sChdDSUhNMG9nS0VJQ0FnSURUaS0tNHFRRRAB!2m1!1s0x0:0xbec5a7f6b8e727aa!3m1!1s2@1:CIHM0ogKEICAgIDTi--4qQE%7CCgsI6bvUsgYQ4M2OCw%7C?hl=id,5,1716854249,05/27/2024 23:57:29,0,-4700165957985294422,119,72,93,248,612,5,Makan malam,Rp 1–25.000,4,5,Roti Bakar Keju,,,,,,,,,,
0x2e69ef54401682e3:0xbec5a7f6b8e727aa,Kedai Roti Ibu Saya,0x2e69ef54401682e3:0xbec5a7f6b8e727aa,ChIJ44IWQFTvaS4RqifnuPanxb4,"https://www.google.com/maps/place/Kedai+Roti+Ibu+Saya/@-6.3574689,106.77544479999999,14z/data=!4m8!1m2!2m1!1sKedai+Roti+Ibu+Saya!3m4!1s0x2e69ef54401682e3:0xbec5a7f6b8e727aa!8m2!3d-6.3574689!4d106.77544479999999",https://search.google.com/local/reviews?placeid=ChIJ44IWQFTvaS4RqifnuPanxb4&q=*&authuser=0&hl=id&gl=US,1144,4.0,ChdDSUhNMG9nS0VJQ0FnSURUby1yUnV3RRAB,CAESY0NBRVFBaHBFUTJwRlNVRlNTWEJEWjI5QlVEZGZURUZCZEc1ZlgxOWZSV2hCU1dWNFVtZDZjbTF0TUdoU1gxQjBZMEZCUVVGQlIyZHVPVEpRUlVOalJXSjZhbkJSV1VGRFNVRQ==,https://www.google.com/maps/contrib/109221583494377269313?hl=id,Rizki Yunita,109221583494377269313,https://lh3.googleusercontent.com/a-/ALV-UjX5tyTcLDoaHRzFK26S9ZQEr7-KiXjc8TQ8t_7qc35y0vrtqNgb=s120-c-rp-mo-ba4-br100,36,59,Untuk harga segini ya worth it sih tempatnya juga vintage² gitu. Waktu kesini sekitar jam 10an dapet tempat di dalam ruangan. Pokoknya paling rekomendasi pizzanya sih wajib coba! Garlic bread juga enak tpi lebih mantap kalau lagi hangat.,"https://lh5.googleusercontent.com/p/AF1QipNaED2SUSBXW3EdsZ0k3MZNuYxmuleoXBKyVXsi, https://lh5.googleusercontent.com/p/AF1QipNYaLbO4iKwlHfehou3dOWx_6tvD5gMkbMFQMRc, https://lh5.googleusercontent.com/p/AF1QipOruEHFpodyPlWgoTUDWVXZ2SY8LDZftQrwdF2W, https://lh5.googleusercontent.com/p/AF1QipP955M6cYeC9KIPcAsadvWu0w43kwajSr6aP_bi, https://lh5.googleusercontent.com/p/AF1QipP5GyDaGnYsmLTFHYJnT7qjRBA2JTCNhTfQjprR, https://lh5.googleusercontent.com/p/AF1QipM51-TbjiD8Xs1AdCG6euRMTnYC3-TyKxPnN-G0, https://lh5.googleusercontent.com/p/AF1QipO0Q1BNTLe9MZkgEZXndyTYJgizqqdhvHl0T2i_, https://lh5.googleusercontent.com/p/AF1QipOq5CFkLv-GVDtQvA-PM_LLWpkWsmikXqqjqVKV, https://lh5.googleusercontent.com/p/AF1QipOisgoMqeDPxBNUR8uxD9gncc11K70s1upcnTWH, https://lh5.googleusercontent.com/p/AF1QipNmZSgV9Np2JGs8UKRtkMIOl_Bcov3nEhgA-rPP, https://lh5.googleusercontent.com/p/AF1QipPgVtIzQZgUHl3nMX1YzC0OtTabfGmynXkqyQFL, https://lh5.googleusercontent.com/p/AF1QipO-crZSju3PWoHjX-Nm-V_6kVVoHPEsYobxUqY7",https://lh5.googleusercontent.com/p/AF1QipNaED2SUSBXW3EdsZ0k3MZNuYxmuleoXBKyVXsi=w150-h150-k-no-p,"AF1QipNaED2SUSBXW3EdsZ0k3MZNuYxmuleoXBKyVXsi, AF1QipNYaLbO4iKwlHfehou3dOWx_6tvD5gMkbMFQMRc, AF1QipOruEHFpodyPlWgoTUDWVXZ2SY8LDZftQrwdF2W, AF1QipP955M6cYeC9KIPcAsadvWu0w43kwajSr6aP_bi, AF1QipP5GyDaGnYsmLTFHYJnT7qjRBA2JTCNhTfQjprR, AF1QipM51-TbjiD8Xs1AdCG6euRMTnYC3-TyKxPnN-G0, AF1QipO0Q1BNTLe9MZkgEZXndyTYJgizqqdhvHl0T2i_, AF1QipOq5CFkLv-GVDtQvA-PM_LLWpkWsmikXqqjqVKV, AF1QipOisgoMqeDPxBNUR8uxD9gncc11K70s1upcnTWH, AF1QipNmZSgV9Np2JGs8UKRtkMIOl_Bcov3nEhgA-rPP, AF1QipPgVtIzQZgUHl3nMX1YzC0OtTabfGmynXkqyQFL, AF1QipO-crZSju3PWoHjX-Nm-V_6kVVoHPEsYobxUqY7",,,,https://www.google.com/maps/reviews/data=!4m8!14m7!1m6!2m5!1sChdDSUhNMG9nS0VJQ0FnSURUby1yUnV3RRAB!2m1!1s0x0:0xbec5a7f6b8e727aa!3m1!1s2@1:CIHM0ogKEICAgIDTo-rRuwE%7CCgwIh_nQsgYQsMit_QE%7C?hl=id,4,1716796551,05/27/2024 07:55:51,0,-4700165957985294422,119,72,93,248,612,4,Makan siang,Rp 25.000–50.000,4,4,"Pizza Beef Oriental, Pizza Meat Lover, Pizza Original, Garlic Bread with Cheese, Pizza Oriental",,,,,,,,,,
0x2e69ef54401682e3:0xbec5a7f6b8e727aa,Kedai Roti Ibu Saya,0x2e69ef54401682e3:0xbec5a7f6b8e727aa,ChIJ44IWQFTvaS4RqifnuPanxb4,"https://www.google.com/maps/place/Kedai+Roti+Ibu+Saya/@-6.3574689,106.77544479999999,14z/data=!4m8!1m2!2m1!1sKedai+Roti+Ibu+Saya!3m4!1s0x2e69ef54401682e3:0xbec5a7f6b8e727aa!8m2!3d-6.3574689!4d106.77544479999999",https://search.google.com/local/reviews?placeid=ChIJ44IWQFTvaS4RqifnuPanxb4&q=*&authuser=0&hl=id&gl=US,1144,4.0,ChdDSUhNMG9nS0VJQ0FnSURUNE1mMnZBRRAB,CAESY0NBRVFBeHBFUTJwRlNVRlNTWEJEWjI5QlVEZGZURUZCZGtkZlgxOWZSV2hDT1dWSVJGWlBUM0E1TTBaQlRXazVUVUZCUVVGQlIyZHVPVEpRUlVOalIxVk5VbHB2V1VGRFNVRQ==,https://www.google.com/maps/contrib/109321912912953524486?hl=id,syahella Haddad,109321912912953524486,https://lh3.googleusercontent.com/a-/ALV-UjX5r1n5we0WP3-_mZo-wp_L_2knZVLkwziOZyPk5KSPIkij2oCQYQ=s120-c-rp-mo-ba5-br100,134,9,"Udah 2x kesini..yg pertama tutup...
Yg kedua alhamdulilah bukaa..

Konsepnya klasik gtu yaa..
Kalo dateng siang rada panas..ada ruangan ac tp krn pintu ke arah taman kebuka terus jadi gak terlalu berasa..

Buat makanan harganya sangat sangat murah banget..

Aku yg dari jam 11 siang sampe jam 4 sore kenyang banget makan ini itu gak sampe 300ribu..termasuk untuk di bungkus..

Pizza meetloversnya yg juara cuma buat perbaikan aja yaa..adonan rotinya rada kurang mateng cuma 13 ribu buat ber 6..
Mienya juga juara 15 ribu..
Rotinya 5 ribuan..coklat keju, keju susu, lemon vanilanya enak..
Minuman serba 5 ribu gelasnya jumbo..

Seblaknya standar kuahnya banjir isinya gak terlalu banyak..rasa jg standar..
Tiramisu siramnya enak 13K
Blackforestnya jg enak 7 ribuan per sliced..

Yg menurut aku gak rekomen nasi gorengnya..maapkan...cuma jauh dari selera kitaa..kaya pake bumbu instan warna merah merona tp rasa hambar banget..

Sukses terus...","https://lh5.googleusercontent.com/p/AF1QipOBM1l1jUM96wpvJHz7Kx9YSQd2nl5-G49BmzVC, https://lh5.googleusercontent.com/p/AF1QipOt1qD27YnT7eBr7OdUYuA_PsvimvOjy999Zt3A, https://lh5.googleusercontent.com/p/AF1QipMqqEre6_dT8VKHWaI-V9Owt9g-KkvSFmh2xa-E, https://lh5.googleusercontent.com/p/AF1QipP-khTIduD3nHHfdJnHEpynZFoOZ9dSgDFLjxg2, https://lh5.googleusercontent.com/p/AF1QipM0mnka1P8RIuEMy6vABqQVMUDtGXfPSzzuJwEV, https://lh5.googleusercontent.com/p/AF1QipOzJZzzXke3bevm6O9zgrbGg6lqaSyUNhUpFJsM, https://lh5.googleusercontent.com/p/AF1QipO-1Bz-zYbdaQz42gy0gi7pb1Y7bwjz3HVcudf6, https://lh5.googleusercontent.com/p/AF1QipOz_YuiVfcMFNUIaQtSUUkhj_zc2SPqhFYP1ew5, https://lh5.googleusercontent.com/p/AF1QipPln3yjWcUMwEioW3jlBUsAt1YOyn-1J5Q1Ddre, https://lh5.googleusercontent.com/p/AF1QipM_T0oHQNkmd5p5Jo9vwMdpYCFyuula1e3LDhTv",https://lh5.googleusercontent.com/p/AF1QipOBM1l1jUM96wpvJHz7Kx9YSQd2nl5-G49BmzVC=w150-h150-k-no-p,"AF1QipOBM1l1jUM96wpvJHz7Kx9YSQd2nl5-G49BmzVC, AF1QipOt1qD27YnT7eBr7OdUYuA_PsvimvOjy999Zt3A, AF1QipMqqEre6_dT8VKHWaI-V9Owt9g-KkvSFmh2xa-E, AF1QipP-khTIduD3nHHfdJnHEpynZFoOZ9dSgDFLjxg2, AF1QipM0mnka1P8RIuEMy6vABqQVMUDtGXfPSzzuJwEV, AF1QipOzJZzzXke3bevm6O9zgrbGg6lqaSyUNhUpFJsM, AF1QipO-1Bz-zYbdaQz42gy0gi7pb1Y7bwjz3HVcudf6, AF1QipOz_YuiVfcMFNUIaQtSUUkhj_zc2SPqhFYP1ew5, AF1QipPln3yjWcUMwEioW3jlBUsAt1YOyn-1J5Q1Ddre, AF1QipM_T0oHQNkmd5p5Jo9vwMdpYCFyuula1e3LDhTv",,,,https://www.google.com/maps/reviews/data=!4m8!14m7!1m6!2m5!1sChdDSUhNMG9nS0VJQ0FnSURUNE1mMnZBRRAB!2m1!1s0x0:0xbec5a7f6b8e727aa!3m1!1s2@1:CIHM0ogKEICAgIDT4Mf2vAE%7CCgwIn5CysgYQyKqBnwE%7C?hl=id,5,1716291615,05/21/2024 11:40:15,0,-4700165957985294422,119,72,93,248,612,5,Makan siang,Rp 1–25.000,5,4,"Kedai Roti, Mie Aceh, Blackforest, Indomie Tom Yam",,,,,,,,,,
0x2e69ef54401682e3:0xbec5a7f6b8e727aa,Kedai Roti Ibu Saya,0x2e69ef54401682e3:0xbec5a7f6b8e727aa,ChIJ44IWQFTvaS4RqifnuPanxb4,"https://www.google.com/maps/place/Kedai+Roti+Ibu+Saya/@-6.3574689,106.77544479999999,14z/data=!4m8!1m2!2m1!1sKedai+Roti+Ibu+Saya!3m4!1s0x2e69ef54401682e3:0xbec5a7f6b8e727aa!8m2!3d-6.3574689!4d106.77544479999999",https://search.google.com/local/reviews?placeid=ChIJ44IWQFTvaS4RqifnuPanxb4&q=*&authuser=0&hl=id&gl=US,1144,4.0,ChZDSUhNMG9nS0VJQ0FnSURUb3RDWEdnEAE,CAESY0NBRVFCQnBFUTJwRlNVRlNTWEJEWjI5QlVEZGZURUZDVFY5ZlgxOWZSV2hEU2tSamJXNXFVSEl5WWpaTlRVbEtPRUZCUVVGQlIyZHVPVEpRU1VOalJtOVpZamgzV1VGRFNVRQ==,https://www.google.com/maps/contrib/111673170615149778857?hl=id,Rika Agustina,111673170615149778857,https://lh3.googleusercontent.com/a-/ALV-UjWWswePBcrSpZI8r2fMjY1VtVMT16q7guQTUb1f3M6Sp1xxiGTg=s120-c-rp-mo-ba5-br100,101,14,"pertama kali cobain kesini, area parkir luar, tempat indoor lumayan sempit tapi outdoor nya lega, ada beberapa spot tempat yg estetik lucu, cabang limo depok ini emang lebih cozy dari cabang pamulang permai.

untuk pelayanannya lumayan makanan keluar satu"" itu lama bgt, staff ga ramah dan ga jutek juga, its ok no comment. tapi ada beberapa staff laki"" yang bikin risih.

makanannya enak porsi ngenyangin dengan harga semurah itu?! dan itu ga ada biaya pajak lagi cuma ada tambahan biaya service. semoga ga menurunkan kualitas.

saran kalo bisa pakai nomor meja, supaya staff ga teriak"" manggil dan cari"" nama customer, kasihan ;')
lebih enak tinggal anter kalo ada nomor meja. over all oke!","https://lh5.googleusercontent.com/p/AF1QipM2cOIAe49GnNJ9JbCL-woEuDJLR58_r1DH2zRY, https://lh5.googleusercontent.com/p/AF1QipMqWmVra-XwuatcVaJLRqp6VlkzaDDYckrRuMIY",https://lh5.googleusercontent.com/p/AF1QipM2cOIAe49GnNJ9JbCL-woEuDJLR58_r1DH2zRY=w150-h150-k-no-p,"AF1QipM2cOIAe49GnNJ9JbCL-woEuDJLR58_r1DH2zRY, AF1QipMqWmVra-XwuatcVaJLRqp6VlkzaDDYckrRuMIY",,,,https://www.google.com/maps/reviews/data=!4m8!14m7!1m6!2m5!1sChZDSUhNMG9nS0VJQ0FnSURUb3RDWEdnEAE!2m1!1s0x0:0xbec5a7f6b8e727aa!3m1!1s2@1:CIHM0ogKEICAgIDTotCXGg%7CCgwI56u9sgYQwMfF4gE%7C?hl=id,5,1716475367,05/23/2024 14:42:47,1,-4700165957985294422,119,72,93,248,612,2,,Rp 1–25.000,5,5,,,,,,,,,,,
0x2e69ef54401682e3:0xbec5a7f6b8e727aa,Kedai Roti Ibu Saya,0x2e69ef54401682e3:0xbec5a7f6b8e727aa,ChIJ44IWQFTvaS4RqifnuPanxb4,"https://www.google.com/maps/place/Kedai+Roti+Ibu+Saya/@-6.3574689,106.77544479999999,14z/data=!4m8!1m2!2m1!1sKedai+Roti+Ibu+Saya!3m4!1s0x2e69ef54401682e3:0xbec5a7f6b8e727aa!8m2!3d-6.3574689!4d106.77544479999999",https://search.google.com/local/reviews?placeid=ChIJ44IWQFTvaS4RqifnuPanxb4&q=*&authuser=0&hl=id&gl=US,1144,4.0,ChZDSUhNMG9nS0VJQ0FnSURUamNqTURREAE,CAESY0NBRVFCUnBFUTJwRlNVRlNTWEJEWjI5QlVEZGZURUZDVVRSZlgxOWZSV2hET1RGWFZuTlJXV1paTkVGNlkwTm1ZMEZCUVVGQlIyZHVPVEpRU1VOalJYRlBhRU56V1VGRFNVRQ==,https://www.google.com/maps/contrib/109902022502685687226?hl=id,fina ghofi,109902022502685687226,https://lh3.googleusercontent.com/a-/ALV-UjXRVPfI1qg873YO9KD0-bfNcu-jQgrcAhzNrVflbfsWtPq6zKsmFg=s120-c-rp-mo-br100,70,9,"Klo pizza & roti dll sih enak, lembut adonannya... tp klo minuman sih kurang, kwitiauw gorengny ga rekomend, spaghettiny jg sesuai harga 😂😂 cm klo mlm penuh.... harga murah bgt, makan b4 sampe kenyang bego, bayar ga sampe 150k","https://lh5.googleusercontent.com/p/AF1QipPCC5ATUFc9a2xXzzrceB-jinoGM2sj-bCO_VkY, https://lh5.googleusercontent.com/p/AF1QipMrVfyEXbPy7cMmTUFEB2pwvr4L-LpH4rgbWJWJ, https://lh5.googleusercontent.com/p/AF1QipN3aX2TWYyh6VQ_11kfHXcctzRx4EcktfyUoBbj, https://lh5.googleusercontent.com/p/AF1QipNrjh9rrPPkpphVDq3P95pPwuNs15eL0j1y14K2",https://lh5.googleusercontent.com/p/AF1QipPCC5ATUFc9a2xXzzrceB-jinoGM2sj-bCO_VkY=w150-h150-k-no-p,"AF1QipPCC5ATUFc9a2xXzzrceB-jinoGM2sj-bCO_VkY, AF1QipMrVfyEXbPy7cMmTUFEB2pwvr4L-LpH4rgbWJWJ, AF1QipN3aX2TWYyh6VQ_11kfHXcctzRx4EcktfyUoBbj, AF1QipNrjh9rrPPkpphVDq3P95pPwuNs15eL0j1y14K2",,,,https://www.google.com/maps/reviews/data=!4m8!14m7!1m6!2m5!1sChZDSUhNMG9nS0VJQ0FnSURUamNqTURREAE!2m1!1s0x0:0xbec5a7f6b8e727aa!3m1!1s2@1:CIHM0ogKEICAgIDTjcjMDQ%7CCgwIwKDNsgYQ4LS13wE%7C?hl=id,4,1716736064,05/26/2024 15:07:44,0,-4700165957985294422,119,72,93,248,612,3,,Rp 25.000–50.000,4,4,,,,,,,,,,,
0x2e69ef54401682e3:0xbec5a7f6b8e727aa,Kedai Roti Ibu Saya,0x2e69ef54401682e3:0xbec5a7f6b8e727aa,ChIJ44IWQFTvaS4RqifnuPanxb4,"https://www.google.com/maps/place/Kedai+Roti+Ibu+Saya/@-6.3574689,106.77544479999999,14z/data=!4m8!1m2!2m1!1sKedai+Roti+Ibu+Saya!3m4!1s0x2e69ef54401682e3:0xbec5a7f6b8e727aa!8m2!3d-6.3574689!4d106.77544479999999",https://search.google.com/local/reviews?placeid=ChIJ44IWQFTvaS4RqifnuPanxb4&q=*&authuser=0&hl=id&gl=US,1144,4.0,ChdDSUhNMG9nS0VJQ0FnSUROOHNQc3pRRRAB,CAESY0NBRVFCaHBFUTJwRlNVRlNTWEJEWjI5QlVEZGZURUZDVlZCZlgxOWZSV2hDV2tKS1l6WnlOekZUZGt0elYzVTNPRUZCUVVGQlIyZHVPVEpRU1VOamNYSXlWVEpKV1VGRFNVRQ==,https://www.google.com/maps/contrib/111924457154766511829?hl=id,Annisa Dini,111924457154766511829,https://lh3.googleusercontent.com/a-/ALV-UjWSUrCf7l0ZbfmyEtiIDMbKh5sKs8CuVg81sYEGpFH72Y6J3A4=s120-c-rp-mo-ba3-br100,11,13,"Pelayanan oke, pegawai ramah ramah dan memastikan pesanan yang dipesan sudah diterima. Harga affordable banget buat kantong pelajar, rasa enak rotinya empuk, paling suka sama tiramisu siramnya soalnya empuk ngga seret gitu loh untuk harga Rp 12.500 udah oke banget buat cemilan atau dessert. Pizza nya juga oke, yang pepperoni best deh. Terus buat makanan beratnya paling suka sama indomie aceh nya. Tempatnya ada indoor dan outdoor, kalo lagi suasana abis ujan sore, outdoor oke banget soalnya ada angin sepoi2 gt.

Recommended food:
Tiramisu siram, pizza pepperoni, garlic bread, indomie aceh.","https://lh5.googleusercontent.com/p/AF1QipMsJuAOdApyGnXC4aKPrzkINCsDBQ5Tj0c7crcP, https://lh5.googleusercontent.com/p/AF1QipMntHaRU2ErawJS-yg14tHRG38WINRLL5mRiUdU, https://lh5.googleusercontent.com/p/AF1QipPxVwgoKfok6Vj3xl1GkF5fnPx1yfmkODkSOu0E, https://lh5.googleusercontent.com/p/AF1QipOU5zILkG8zJxqAx4UXpPw1e8uMa91IHLdK6uis",https://lh5.googleusercontent.com/p/AF1QipMsJuAOdApyGnXC4aKPrzkINCsDBQ5Tj0c7crcP=w150-h150-k-no-p,"AF1QipMsJuAOdApyGnXC4aKPrzkINCsDBQ5Tj0c7crcP, AF1QipMntHaRU2ErawJS-yg14tHRG38WINRLL5mRiUdU, AF1QipPxVwgoKfok6Vj3xl1GkF5fnPx1yfmkODkSOu0E, AF1QipOU5zILkG8zJxqAx4UXpPw1e8uMa91IHLdK6uis",,,,https://www.google.com/maps/reviews/data=!4m8!14m7!1m6!2m5!1sChdDSUhNMG9nS0VJQ0FnSUROOHNQc3pRRRAB!2m1!1s0x0:0xbec5a7f6b8e727aa!3m1!1s2@1:CIHM0ogKEICAgIDN8sPszQE%7CCgwIyZ_erQYQsLGEpgM%7C?hl=id,5,1706528713,01/29/2024 11:45:13,2,-4700165957985294422,119,72,93,248,612,5,Sarapan siang,Rp 25.000–50.000,5,5,"Pizza Meat Lover, Tiramisu Cakes",,,,,,,,,,
0x2e69ef54401682e3:0xbec5a7f6b8e727aa,Kedai Roti Ibu Saya,0x2e69ef54401682e3:0xbec5a7f6b8e727aa,ChIJ44IWQFTvaS4RqifnuPanxb4,"https://www.google.com/maps/place/Kedai+Roti+Ibu+Saya/@-6.3574689,106.77544479999999,14z/data=!4m8!1m2!2m1!1sKedai+Roti+Ibu+Saya!3m4!1s0x2e69ef54401682e3:0xbec5a7f6b8e727aa!8m2!3d-6.3574689!4d106.77544479999999",https://search.google.com/local/reviews?placeid=ChIJ44IWQFTvaS4RqifnuPanxb4&q=*&authuser=0&hl=id&gl=US,1144,4.0,ChdDSUhNMG9nS0VJQ0FnSUM5b09MbXBBRRAB,CAESY0NBRVFCeHBFUTJwRlNVRlNTWEJEWjI5QlVEZGZURUZDVlZSZlgxOWZSV2hCTm1reGRtNVlRM1Y1WjNoRVFraFBXVUZCUVVGQlIyZHVPVEpRU1VOalozZzJOM0ZGV1VGRFNVRQ==,https://www.google.com/maps/contrib/115202698744047801503?hl=id,Im Febry,115202698744047801503,https://lh3.googleusercontent.com/a-/ALV-UjV5jcwFq_heuxii89OljG2sZKredVofltyeaNGLQ1fjGe19gUH6=s120-c-rp-mo-br100,18,1,"Kesan pertama saya setelah datang k Kedai Roti Ibu Saya :
1. Tempat parkir lumayan luas, tukang parkirnya ngebantu bgt, tp klo dtg weekend udah dpastiin penuh terus, lbh enak pake motor klo kesini..
2. Suasana nya lumayan cozy tp yg indoor tlg bgt kak AC nya dibenerin krn ga berasa & pintu yg buat ke outdoor nya ditutup aja biar AC lbh berasa, waiter nya ramah² & gercep bgt buat nanya pesanan qta yg blm dtg apa aja..
3. Harga murah bgt, seorang pizza hrg 13rb itu dah effort bgt dng hrg sgtu tp bs ksh rasa yg enak & ramah dikantong buat pelajar, mahasiswa & emak² yg pengen me time tp minim budget..
4. Rasa makanan dengan harga semurah itu udah lumayan enak, klo pun ada yg blg dng hrg lbh murah bs dpt roti lbh enak well dliat dl ini kan konsep cafe, jd suasana cafe, pelayanan & biaya lain² dimasukkan ke harga makanan yg dijual, jd udah lumayan ok koq sesuai dng yg qta bayar. Pizza nya worth to try, indomie aceh pedasnya coba dkurangin kuah nya sedikit biar bumbu nya terasa, tiramisu siram kurang manis, roti lainnya lumayan enak..","https://lh5.googleusercontent.com/p/AF1QipMbwg7VEFv6PTZoIIaE3e-jYu0rTmeSoBSQSN_-, https://lh5.googleusercontent.com/p/AF1QipMEtzhm9OtxVnmAYzR_cJAIyXSEvlDAkxQuAEnp, https://lh5.googleusercontent.com/p/AF1QipN9QS4gc-T6FloXhDXxKM51H6BfKklKbGfUhCOk, https://lh5.googleusercontent.com/p/AF1QipOx_FVbouWq2_4bnDGowTf1FTe0-vAxHbMBGVso, https://lh5.googleusercontent.com/p/AF1QipP7L2Hn3lKH0jDhpKAYKj2t9pbDpLxqZClpBa1T",https://lh5.googleusercontent.com/p/AF1QipMbwg7VEFv6PTZoIIaE3e-jYu0rTmeSoBSQSN_-=w150-h150-k-no-p,"AF1QipMbwg7VEFv6PTZoIIaE3e-jYu0rTmeSoBSQSN_-, AF1QipMEtzhm9OtxVnmAYzR_cJAIyXSEvlDAkxQuAEnp, AF1QipN9QS4gc-T6FloXhDXxKM51H6BfKklKbGfUhCOk, AF1QipOx_FVbouWq2_4bnDGowTf1FTe0-vAxHbMBGVso, AF1QipP7L2Hn3lKH0jDhpKAYKj2t9pbDpLxqZClpBa1T",,,,https://www.google.com/maps/reviews/data=!4m8!14m7!1m6!2m5!1sChdDSUhNMG9nS0VJQ0FnSUM5b09MbXBBRRAB!2m1!1s0x0:0xbec5a7f6b8e727aa!3m1!1s2@1:CIHM0ogKEICAgIC9oOLmpAE%7CCgwIkMSArwYQiKug3gI%7C?hl=id,4,1709187600,02/29/2024 06:20:00,3,-4700165957985294422,119,72,93,248,612,5,Lainnya,Rp 1–25.000,4,4,Pizza Roti Coklat,,,,,,,,,,
0x2e69ef54401682e3:0xbec5a7f6b8e727aa,Kedai Roti Ibu Saya,0x2e69ef54401682e3:0xbec5a7f6b8e727aa,ChIJ44IWQFTvaS4RqifnuPanxb4,"https://www.google.com/maps/place/Kedai+Roti+Ibu+Saya/@-6.3574689,106.77544479999999,14z/data=!4m8!1m2!2m1!1sKedai+Roti+Ibu+Saya!3m4!1s0x2e69ef54401682e3:0xbec5a7f6b8e727aa!8m2!3d-6.3574689!4d106.77544479999999",https://search.google.com/local/reviews?placeid=ChIJ44IWQFTvaS4RqifnuPanxb4&q=*&authuser=0&hl=id&gl=US,1144,4.0,ChZDSUhNMG9nS0VJQ0FnSUNUbTYtTWJnEAE,CAESY0NBRVFDQnBFUTJwRlNVRlNTWEJEWjI5QlVEZGZURUZDWm5wZlgxOWZSV2hFWTJFNVVYTjVWa2hLTUVkNmFqTjNORUZCUVVGQlIyZHVPVEpRVFVOalJ6aFdPVUp6V1VGRFNVRQ==,https://www.google.com/maps/contrib/114261628788714667288?hl=id,mufidah fidah,114261628788714667288,https://lh3.googleusercontent.com/a-/ALV-UjV2Y1EMgt5Z4dHdvbanSpQ-328jubwx-7VGIGdmHjImQK5gVorh=s120-c-rp-mo-ba3-br100,22,0,"Murah meriah muntah!!! Lumayan enak rotinya, murah2. Pizza nya juara. Klo masih panas sih enak ya. Fresh from the oven. Ambience nya ya seperti cafe cafe pada umunya. Pegawainya gercep2.","https://lh5.googleusercontent.com/p/AF1QipNd9qe8ylJwhX8e8lM2qqI5F9pwmHkJ28kHXzV6, https://lh5.googleusercontent.com/p/AF1QipP2bZCsz5B4x1PSz37iAGyWEv5oZ37osj_eiPHf, https://lh5.googleusercontent.com/p/AF1QipMu4EciN0A1aRbMQuhvcB6DT9Btf_mvZOSmhiqz, https://lh5.googleusercontent.com/p/AF1QipNElXLPhOaXYCqDzpMXYjtS4_XZZRKcIKEOgu6S",https://lh5.googleusercontent.com/p/AF1QipNd9qe8ylJwhX8e8lM2qqI5F9pwmHkJ28kHXzV6=w150-h150-k-no-p,"AF1QipNd9qe8ylJwhX8e8lM2qqI5F9pwmHkJ28kHXzV6, AF1QipP2bZCsz5B4x1PSz37iAGyWEv5oZ37osj_eiPHf, AF1QipMu4EciN0A1aRbMQuhvcB6DT9Btf_mvZOSmhiqz, AF1QipNElXLPhOaXYCqDzpMXYjtS4_XZZRKcIKEOgu6S",,,,https://www.google.com/maps/reviews/data=!4m8!14m7!1m6!2m5!1sChZDSUhNMG9nS0VJQ0FnSUNUbTYtTWJnEAE!2m1!1s0x0:0xbec5a7f6b8e727aa!3m1!1s2@1:CIHM0ogKEICAgICTm6-Mbg%7CCgwIyOynsgYQ4KS1wgI%7C?hl=id,5,1716123208,05/19/2024 12:53:28,0,-4700165957985294422,119,72,93,248,612,5,,,4,5,,,,,,,,,,,
0x2e69ef54401682e3:0xbec5a7f6b8e727aa,Kedai Roti Ibu Saya,0x2e69ef54401682e3:0xbec5a7f6b8e727aa,ChIJ44IWQFTvaS4RqifnuPanxb4,"https://www.google.com/maps/place/Kedai+Roti+Ibu+Saya/@-6.3574689,106.77544479999999,14z/data=!4m8!1m2!2m1!1sKedai+Roti+Ibu+Saya!3m4!1s0x2e69ef54401682e3:0xbec5a7f6b8e727aa!8m2!3d-6.3574689!4d106.77544479999999",https://search.google.com/local/reviews?placeid=ChIJ44IWQFTvaS4RqifnuPanxb4&q=*&authuser=0&hl=id&gl=US,1144,4.0,ChdDSUhNMG9nS0VJQ0FnSUNkNkxYMzlBRRAB,CAESY0NBRVFDUnBFUTJwRlNVRlNTWEJEWjI5QlVEZGZURUZDYVRaZlgxOWZSV2hFUW1SeFlsTnNTSFJmWjBvemJXNWZZMEZCUVVGQlIyZHVPVEpRVFVOamJXeDNZV0l3V1VGRFNVRQ==,https://www.google.com/maps/contrib/117459943080027674758?hl=id,amanda salshadilla,117459943080027674758,https://lh3.googleusercontent.com/a-/ALV-UjWG0-AwhiiJupv9qvTrsTLFAh2zVTqdsBM1dDlquy2nNTbAXagY=s120-c-rp-mo-ba4-br100,38,2,"Datang di hari sabtu sekitar jam 1 siang, lumayan ramai pengunjung. Agak kesulitan dapat tempat, semi outdoor jadi kalau hujan agak khawatir. Tempatnya asri, banyak tanaman dan pohon-pohon seperti di halaman belakang rumah. Tempat duduk agak random tidak ada nomor meja. Kalau mau pesan langsung ke bagian kasir dan bayar kemudian nanti makanan akan diantar ke meja. Waktu menunggu pesanan datang lumayan sangat lama. Jadi untuk yang terburu-buru sebaiknya jangan. Untuk rasa enak, harga murah meriah. Indomie tomyum nya enak, mie baladonya tidak ada topping hanya kerupuk pangsit saja. Untuk rotinya lembut, isian juga ga pelit. Minuman rasanya kurang enak (kemarin pesan bubble gum). Pizza paperoninya enak, dough nya lembut, tapi kurang garing sedikit. Bener bener rasa roti. Oiya parkirannya lumayan luas. Boleh guys dicoba mampir overall 3.5/5","https://lh5.googleusercontent.com/p/AF1QipNXOy9u99lXFrvdzgy3m0DetE9LbPjhDyWg1udV, https://lh5.googleusercontent.com/p/AF1QipNFtRZgV89tbQl_y_QrxxHTAJtPHHLu92V5c9Va, https://lh5.googleusercontent.com/p/AF1QipPAszANFj-42OMO5DLi5hLMMnYheVx6Uaa6T8CB, https://lh5.googleusercontent.com/p/AF1QipN4LK_8953YDBC5wLYtvW96boUpMZscY3zaNSN9, https://lh5.googleusercontent.com/p/AF1QipMm3NFCgtW-7Ag9Smq2A6jHOg1n9hd5gEfi4tzX, https://lh5.googleusercontent.com/p/AF1QipMHtT5Su-Q0_no0j69mHDZMDqulJ8iIXNDUc02L",https://lh5.googleusercontent.com/p/AF1QipNXOy9u99lXFrvdzgy3m0DetE9LbPjhDyWg1udV=w150-h150-k-no-p,"AF1QipNXOy9u99lXFrvdzgy3m0DetE9LbPjhDyWg1udV, AF1QipNFtRZgV89tbQl_y_QrxxHTAJtPHHLu92V5c9Va, AF1QipPAszANFj-42OMO5DLi5hLMMnYheVx6Uaa6T8CB, AF1QipN4LK_8953YDBC5wLYtvW96boUpMZscY3zaNSN9, AF1QipMm3NFCgtW-7Ag9Smq2A6jHOg1n9hd5gEfi4tzX, AF1QipMHtT5Su-Q0_no0j69mHDZMDqulJ8iIXNDUc02L",,,,https://www.google.com/maps/reviews/data=!4m8!14m7!1m6!2m5!1sChdDSUhNMG9nS0VJQ0FnSUNkNkxYMzlBRRAB!2m1!1s0x0:0xbec5a7f6b8e727aa!3m1!1s2@1:CIHM0ogKEICAgICd6LX39AE%7CCgsI6auhrgYQyJ7HDA%7C?hl=id,4,1707628009,02/11/2024 05:06:49,3,-4700165957985294422,119,72,93,248,612,3,Makan siang,Rp 25.000–50.000,4,4,,,,,,,,,,,
