0x2e69ef54401682e3:0xbec5a7f6b8e727aa,Kedai Roti Ibu Saya,0x2e69ef54401682e3:0xbec5a7f6b8e727aa,ChIJ44IWQFTvaS4RqifnuPanxb4,"https://www.google.com/maps/place/Kedai+Roti+Ibu+Saya/@-6.3574689,106.77544479999999,14z/data=!4m8!1m2!2m1!1sKedai+Roti+Ibu+Saya!3m4!1s0x2e69ef54401682e3:0xbec5a7f6b8e727aa!8m2!3d-6.3574689!4d106.77544479999999",https://search.google.com/local/reviews?placeid=ChIJ44IWQFTvaS4RqifnuPanxb4&q=*&authuser=0&hl=id&gl=US,1144,4.0,ChdDSUhNMG9nS0VJQ0FnSUNkamZ5andnRRAB,CAESY0NBRVFVaHBFUTJwRlNVRlNTWEJEWjI5QlVEZGZURUZTVTFWZlgxOWZSV2hFYzBVNWVGaFdWVXRCVlZZeFJFeDZNRUZCUVVGQlIyZHVPVEpTYTBOamEzQjJUMUZuV1VGRFNVRQ==,https://www.google.com/maps/contrib/107003943046638889985?hl=id,Devs,107003943046638889985,https://lh3.googleusercontent.com/a-/ALV-UjXSmSCnvdgxCgIi_447UvhcqSaHuVHW6IuoQxnIo900u6fuGZ1E=s120-c-rp-mo-ba3-br100,26,17,"Sayangnya pengalaman pertama saya kesini sangat buruk. Begitu datang mejanya masih kotor belum dibersihkan, jadi kurang nyaman. Pelayanannya juga sangat buruk, pesanan pizza 1 jam ga dibuat juga, padahal yg datang setelah saya udah diantar. Harus komplain dulu baru dibuatin. Waktu komplain malah bilang baru dibuat (stlh 1 jam menunggu) dan adonannya abis dan beralasan kalau meja yg lain juga ada yg sama. Harusnya hal itu bukan jadi pembenaran dong.
Karyawannya juga banyak tapi bad service, ya sebanding dengan harga makanannya yg murah. Cukup sekali aja kesini, perut ga kenyang, mood udh berantakan duluan.

Tips: lain kali pelanggannya dikasih papan nomor meja aja pas pesan, biar waiternya ga bingung nyari yg pesan siapa, tinggal cari nomor mejanya, dan orderannya ga ketuker sama yg lain",,,,,,,https://www.google.com/maps/reviews/data=!4m8!14m7!1m6!2m5!1sChdDSUhNMG9nS0VJQ0FnSUNkamZ5andnRRAB!2m1!1s0x0:0xbec5a7f6b8e727aa!3m1!1s2@1:CIHM0ogKEICAgICdjfyjwgE%7CCgwI1IvBrgYQ6O_e2gI%7C?hl=id,1,1708148180,02/17/2024 05:36:20,1,-4700165957985294422,119,72,93,248,612,1,Makan siang,Rp 1–25.000,1,3,,,,,,,,,,,
0x2e69ef54401682e3:0xbec5a7f6b8e727aa,Kedai Roti Ibu Saya,0x2e69ef54401682e3:0xbec5a7f6b8e727aa,ChIJ44IWQFTvaS4RqifnuPanxb4,"https://www.google.com/maps/place/Kedai+Roti+Ibu+Saya/@-6.3574689,106.77544479999999,14z/data=!4m8!1m2!2m1!1sKedai+Roti+Ibu+Saya!3m4!1s0x2e69ef54401682e3:0xbec5a7f6b8e727aa!8m2!3d-6.3574689!4d106.77544479999999",https://search.google.com/local/reviews?placeid=ChIJ44IWQFTvaS4RqifnuPanxb4&q=*&authuser=0&hl=id&gl=US,1144,4.0,ChZDSUhNMG9nS0VJQ0FnSUQ5NXVDYUlBEAE,CAESY0NBRVFVeHBFUTJwRlNVRlNTWEJEWjI5QlVEZGZURUZTVldwZlgxOWZSV2hEWDFWWWIyWlhRV1l3Ym1GdFQybFpZMEZCUVVGQlIyZHVPVEpTYTBOalltNXdYM1JqV1VGRFNVRQ==,https://www.google.com/maps/contrib/115490537991892097302?hl=id,Najwa Amanda,115490537991892097302,https://lh3.googleusercontent.com/a-/ALV-UjURUsELWjJJeAmAuNuYqLOxq2tIOV0v4QiDOkYAl-i7IRMXNzhg=s120-c-rp-mo-ba2-br100,9,6,"BAGUS BGTTTT JUJUR! diajakin sama temen makan di sini is another level of happiness bc i was find out a heaven. bisa makan di outdoor atau indoor, menunya banyak, pelayanannya oke, parkirnya juga lumayan luas","https://lh5.googleusercontent.com/p/AF1QipOzI2h4ANqAyK8FVyyDNgPvoR4dDXSPIyGUqhp-, https://lh5.googleusercontent.com/p/AF1QipMYgIbY74fTrw5BJOEnPxTzIBvRk_CQL1Y2V3N-",https://lh5.googleusercontent.com/p/AF1QipOzI2h4ANqAyK8FVyyDNgPvoR4dDXSPIyGUqhp-=w150-h150-k-no-p,"AF1QipOzI2h4ANqAyK8FVyyDNgPvoR4dDXSPIyGUqhp-, AF1QipMYgIbY74fTrw5BJOEnPxTzIBvRk_CQL1Y2V3N-",,,,https://www.google.com/maps/reviews/data=!4m8!14m7!1m6!2m5!1sChZDSUhNMG9nS0VJQ0FnSUQ5NXVDYUlBEAE!2m1!1s0x0:0xbec5a7f6b8e727aa!3m1!1s2@1:CIHM0ogKEICAgID95uCaIA%7CCgsIn4rVrwYQkOzeBw%7C?hl=id,5,1710572831,03/16/2024 07:07:11,0,-4700165957985294422,119,72,93,248,612,5,Makan siang,Rp 1–25.000,5,5,"Roti Keju Susu, Black Forest Cake, Garlic Bread with Cheese, Tiramisu Siram",,,,,,,,,,
0x2e69ef54401682e3:0xbec5a7f6b8e727aa,Kedai Roti Ibu Saya,0x2e69ef54401682e3:0xbec5a7f6b8e727aa,ChIJ44IWQFTvaS4RqifnuPanxb4,"https://www.google.com/maps/place/Kedai+Roti+Ibu+Saya/@-6.3574689,106.77544479999999,14z/data=!4m8!1m2!2m1!1sKedai+Roti+Ibu+Saya!3m4!1s0x2e69ef54401682e3:0xbec5a7f6b8e727aa!8m2!3d-6.3574689!4d106.77544479999999",https://search.google.com/local/reviews?placeid=ChIJ44IWQFTvaS4RqifnuPanxb4&q=*&authuser=0&hl=id&gl=US,1144,4.0,ChdDSUhNMG9nS0VJQ0FnSUNCLXFTejVBRRAB,CAESY0NBRVFWQnBFUTJwRlNVRlNTWEJEWjI5QlVEZGZURUZTYjBkZlgxOWZSV2hEVERGS1ZsQkRhMU55ZFd4WGNuQnVPRUZCUVVGQlIyZHVPVEpTYjBObGMwZFhSRXBCV1VGRFNVRQ==,https://www.google.com/maps/contrib/115667701628172256901?hl=id,Rahma Reza Fitriana,115667701628172256901,https://lh3.googleusercontent.com/a/ACg8ocJOtiKRV1Q2uFi55uoXu15Vnp4zcjrAV4CUZ-q7a3dQSPox2g=s120-c-rp-mo-br100,5,1,"sepertinya tokonya belum siap ramai ya...😊
berikut saran yang bisa saya berikan :
- buat regulasi waiting list meja. supaya pengunjung tidak mondar mandir diem saja nunggu meja yg kosong (sangat menggangu dan dari pov pengunjung pun pasti kebingungan), agar lebih kondusif, bisa ada karyawan yang khusus mengatur meja dan pengunjung datang.
- bisa lebih di tekankan kepada pelayan untuk lebih ramah.
- bisa dibuat nomor meja yg standing, jd pelayan tidak teriak2 untuk panggil nama saat mengantar pesanan. selain agar lebih kondusif, juga agar lebih cepat. (btw saat saya pesan kenapa dikasir di tanya nomor meja pdhl ga semua meja ada nomornya ehhe. termasuk di meja saya, tidak ada nomornya. mungkin bisa lebih di briefing)
semoga segera diperbaiki dan sukses terus ya
- tp overall makanannya enak, khususnya bakerynya. keliatannya memang sudah pro dalam per bakingan yaaa
- saya sgt mengapresiasi ada pelayan yang sangat cekatan dan gesit (2 orang) tapi selebihnya saya rasa perlu di briefing lagi

semangaat bu","https://lh5.googleusercontent.com/p/AF1QipOurvvcY7pQAGnMQxFzxIc-VlWfZNvLPu6U2b9T, https://lh5.googleusercontent.com/p/AF1QipNPc7znjp2Poh_W0_ywWZX39cxEHXq4WPdUTgrE, https://lh5.googleusercontent.com/p/AF1QipPnNrgRQkzOC-icZr-WVRNslBi1PeEgNIhCuKu9, https://lh5.googleusercontent.com/p/AF1QipOq2s4xFe2qoj_PbS5wXvsCoag6_GxH5M9p9qA9",https://lh5.googleusercontent.com/p/AF1QipOurvvcY7pQAGnMQxFzxIc-VlWfZNvLPu6U2b9T=w150-h150-k-no-p,"AF1QipOurvvcY7pQAGnMQxFzxIc-VlWfZNvLPu6U2b9T, AF1QipNPc7znjp2Poh_W0_ywWZX39cxEHXq4WPdUTgrE, AF1QipPnNrgRQkzOC-icZr-WVRNslBi1PeEgNIhCuKu9, AF1QipOq2s4xFe2qoj_PbS5wXvsCoag6_GxH5M9p9qA9",,,,https://www.google.com/maps/reviews/data=!4m8!14m7!1m6!2m5!1sChdDSUhNMG9nS0VJQ0FnSUNCLXFTejVBRRAB!2m1!1s0x0:0xbec5a7f6b8e727aa!3m1!1s2@1:CIHM0ogKEICAgICB-qSz5AE%7CCgsI4faVnQYQ0NbMQA%7C?hl=id,3,1671789409,12/23/2022 09:56:49,29,-4700165957985294422,119,72,93,248,612,,,,,,,,,,,,,,,,
0x2e69ef54401682e3:0xbec5a7f6b8e727aa,Kedai Roti Ibu Saya,0x2e69ef54401682e3:0xbec5a7f6b8e727aa,ChIJ44IWQFTvaS4RqifnuPanxb4,"https://www.google.com/maps/place/Kedai+Roti+Ibu+Saya/@-6.3574689,106.77544479999999,14z/data=!4m8!1m2!2m1!1sKedai+Roti+Ibu+Saya!3m4!1s0x2e69ef54401682e3:0xbec5a7f6b8e727aa!8m2!3d-6.3574689!4d106.77544479999999",https://search.google.com/local/reviews?placeid=ChIJ44IWQFTvaS4RqifnuPanxb4&q=*&authuser=0&hl=id&gl=US,1144,4.0,ChdDSUhNMG9nS0VJQ0FnSUNKNnZuLWl3RRAB,CAESY0NBRVFWUnBFUTJwRlNVRlNTWEJEWjI5QlVEZGZURUZUWlVsZlgxOWZSV2hDTVVNNVNFTkNUR0ZxUjJGdFRtdzRPRUZCUVVGQlIyZHVPVEpTZDBOak9FUnViR00wV1VGRFNVRQ==,https://www.google.com/maps/contrib/101463475166349454247?hl=id,Siti Mariyam,101463475166349454247,https://lh3.googleusercontent.com/a/ACg8ocJ3Jirf-1C8hq7tlvIWkZ5AHF-Gel6PuW66rQmxFsmatpbWXg=s120-c-rp-mo-br100,6,0,"Mba mas sy beli bukan minta klo produk yg d rasa gagal jgn d kasih k customer ya masa hangus begini d kasih juga si mba mba ya Alloh
Semoga atasannya liat yaa kerjaan anak buah nya
Pantes aja nga d ksh no telpon yg bisa d hubungin kecewa","https://lh5.googleusercontent.com/p/AF1QipPR0Mwc7JZV3cieG0ADvs2TqYSSq2r16v_XbfRc, https://lh5.googleusercontent.com/p/AF1QipMCclRBxJ7Fw2tpQFThYGmRn4j2WXJcOOJrzTrX",https://lh5.googleusercontent.com/p/AF1QipPR0Mwc7JZV3cieG0ADvs2TqYSSq2r16v_XbfRc=w150-h150-k-no-p,"AF1QipPR0Mwc7JZV3cieG0ADvs2TqYSSq2r16v_XbfRc, AF1QipMCclRBxJ7Fw2tpQFThYGmRn4j2WXJcOOJrzTrX",,,,https://www.google.com/maps/reviews/data=!4m8!14m7!1m6!2m5!1sChdDSUhNMG9nS0VJQ0FnSUNKNnZuLWl3RRAB!2m1!1s0x0:0xbec5a7f6b8e727aa!3m1!1s2@1:CIHM0ogKEICAgICJ6vn-iwE%7CCgwIjdHBqwYQiL6koAM%7C?hl=id,1,1701865613,12/06/2023 12:26:53,2,-4700165957985294422,119,72,93,248,612,Makan di tempat,Sarapan siang,Rp 25.000–50.000,,,,,,,,,,,,,
0x2e69ef54401682e3:0xbec5a7f6b8e727aa,Kedai Roti Ibu Saya,0x2e69ef54401682e3:0xbec5a7f6b8e727aa,ChIJ44IWQFTvaS4RqifnuPanxb4,"https://www.google.com/maps/place/Kedai+Roti+Ibu+Saya/@-6.3574689,106.77544479999999,14z/data=!4m8!1m2!2m1!1sKedai+Roti+Ibu+Saya!3m4!1s0x2e69ef54401682e3:0xbec5a7f6b8e727aa!8m2!3d-6.3574689!4d106.77544479999999",https://search.google.com/local/reviews?placeid=ChIJ44IWQFTvaS4RqifnuPanxb4&q=*&authuser=0&hl=id&gl=US,1144,4.0,ChZDSUhNMG9nS0VJQ0FnSURwdV9LTmN3EAE,CAESY0NBRVFWaHBFUTJwRlNVRlNTWEJEWjI5QlVEZGZURUZUZERGZlgxOWZSV2hEVTI4eWJXSnlVMFZsU214WWJERnFhMEZCUVVGQlIyZHVPVEpTTUVOa1luazBVMGRKV1VGRFNVRQ==,https://www.google.com/maps/contrib/100878576116468451623?hl=id,chriscorp80,100878576116468451623,https://lh3.googleusercontent.com/a-/ALV-UjXEogvnpmZgvPdCv1wb2WLkaiGVLZq2HAr6IqAzZOClda6Or_ke=s120-c-rp-mo-ba5-br100,324,23,"Penasaran dengan review orang yg negatif tentang tempat ini, ternyata ulasan mereka ga sepenuhnya salah dan pihak restoran tidak memperbaiki kesalahan atau ulasan dari para pengulas tadi, masih banyak ditemukan ketidak nyamanan selama disini terutama dengan pelayanannya","https://lh5.googleusercontent.com/p/AF1QipOODx921TI4ZASFe7Q2meyFudkfnmgO-cR_bzkU, https://lh5.googleusercontent.com/p/AF1QipPuvqNL3A9h8rbUQ9WnwflZ0iqzGmiX7vh2YWbo, https://lh5.googleusercontent.com/p/AF1QipNDg-RKHrbrCNMAl5g69VQqONtq3oZA_jGSs4a1, https://lh5.googleusercontent.com/p/AF1QipNlNBi04yjhxpwV5T-LPPMmvMIDzQBalNX3XW3b, https://lh5.googleusercontent.com/p/AF1QipMbMfO9CLaAZD8wEphPEYYoQdin9o8WXUSlD9pU, https://lh5.googleusercontent.com/p/AF1QipNmfZEkpo7rbqosXSFkU_mAXD9EcNsn3MS58svN, https://lh5.googleusercontent.com/p/AF1QipPxlhcpFDh4tTWWoU8pLcKGPdNSvW-ZahBVcPha, https://lh5.googleusercontent.com/p/AF1QipMPnjE5OycIGDP_aFARr6EQHkvaAPQuYfyPU2tM",https://lh5.googleusercontent.com/p/AF1QipOODx921TI4ZASFe7Q2meyFudkfnmgO-cR_bzkU=w150-h150-k-no-p,"AF1QipOODx921TI4ZASFe7Q2meyFudkfnmgO-cR_bzkU, AF1QipPuvqNL3A9h8rbUQ9WnwflZ0iqzGmiX7vh2YWbo, AF1QipNDg-RKHrbrCNMAl5g69VQqONtq3oZA_jGSs4a1, AF1QipNlNBi04yjhxpwV5T-LPPMmvMIDzQBalNX3XW3b, AF1QipMbMfO9CLaAZD8wEphPEYYoQdin9o8WXUSlD9pU, AF1QipNmfZEkpo7rbqosXSFkU_mAXD9EcNsn3MS58svN, AF1QipPxlhcpFDh4tTWWoU8pLcKGPdNSvW-ZahBVcPha, AF1QipMPnjE5OycIGDP_aFARr6EQHkvaAPQuYfyPU2tM",,,,https://www.google.com/maps/reviews/data=!4m8!14m7!1m6!2m5!1sChZDSUhNMG9nS0VJQ0FnSURwdV9LTmN3EAE!2m1!1s0x0:0xbec5a7f6b8e727aa!3m1!1s2@1:CIHM0ogKEICAgIDpu_KNcw%7CCgsI4NC5pwYQ-Lj5Sg%7C?hl=id,3,1693345888,08/29/2023 21:51:28,3,-4700165957985294422,119,72,93,248,612,2,Makan malam,Rp 1–25.000,3,4,"Cireng, Kedai Roti",,,,,,,,,,
0x2e69ef54401682e3:0xbec5a7f6b8e727aa,Kedai Roti Ibu Saya,0x2e69ef54401682e3:0xbec5a7f6b8e727aa,ChIJ44IWQFTvaS4RqifnuPanxb4,"https://www.google.com/maps/place/Kedai+Roti+Ibu+Saya/@-6.3574689,106.77544479999999,14z/data=!4m8!1m2!2m1!1sKedai+Roti+Ibu+Saya!3m4!1s0x2e69ef54401682e3:0xbec5a7f6b8e727aa!8m2!3d-6.3574689!4d106.77544479999999",https://search.google.com/local/reviews?placeid=ChIJ44IWQFTvaS4RqifnuPanxb4&q=*&authuser=0&hl=id&gl=US,1144,4.0,ChdDSUhNMG9nS0VJQ0FnSUNSd2U2dXBnRRAB,CAESY0NBRVFWeHBFUTJwRlNVRlNTWEJEWjI5QlVEZGZURUZVUVROZlgxOWZSV2hDWmsxblYwY3dRVkZqU0hKYVNtRjBWVUZCUVVGQlIyZHVPVEpTTUVObFRFdzRNamMwV1VGRFNVRQ==,https://www.google.com/maps/contrib/116743521578453167028?hl=id,Keysha Rike Amelia (Key),116743521578453167028,https://lh3.googleusercontent.com/a-/ALV-UjVz6m-cYCbmB1018gOLnU3cFvgAEj1_TRnpUf4RIJA_8Uhs3J7zPQ=s120-c-rp-mo-br100,25,2,"Lokasinya sangat strategis dan tidak jauh dari Fakultas Tekni UPNVJ. Tempatnya bagus, nyaman, dan bersih sehingga bisa betah berkumpul bersama teman untuk nugas atau makan bersama. Harga makanan disini sangat murah dan bersih, harganya mulai dari 5000 untuk berbagai jenis roti dan minuman. Tempatnya ada indoor dan outdoor.

Terimakasih kedai roti ibu
Sukses selalu","https://lh5.googleusercontent.com/p/AF1QipNuxpF34U2ikHkMxuLio_Nu1nczkY_yH8PRiLFC, https://lh5.googleusercontent.com/p/AF1QipOwberVx4adxog941OWOtlWTmqoBnxvvgLD4tib, https://lh5.googleusercontent.com/p/AF1QipOiIr4dTcLbvr2EeOuFOu-XAkssIorvr_R5MUGL, https://lh5.googleusercontent.com/p/AF1QipPPGpOTDfm_d1kebA3EfrYnwg7huh-j0LzouBI1, https://lh5.googleusercontent.com/p/AF1QipPI5yIIcteH4ysdfC50vrROK1WqGgETWrS6Xq_O",https://lh5.googleusercontent.com/p/AF1QipNuxpF34U2ikHkMxuLio_Nu1nczkY_yH8PRiLFC=w150-h150-k-no-p,"AF1QipNuxpF34U2ikHkMxuLio_Nu1nczkY_yH8PRiLFC, AF1QipOwberVx4adxog941OWOtlWTmqoBnxvvgLD4tib, AF1QipOiIr4dTcLbvr2EeOuFOu-XAkssIorvr_R5MUGL, AF1QipPPGpOTDfm_d1kebA3EfrYnwg7huh-j0LzouBI1, AF1QipPI5yIIcteH4ysdfC50vrROK1WqGgETWrS6Xq_O",,,,https://www.google.com/maps/reviews/data=!4m8!14m7!1m6!2m5!1sChdDSUhNMG9nS0VJQ0FnSUNSd2U2dXBnRRAB!2m1!1s0x0:0xbec5a7f6b8e727aa!3m1!1s2@1:CIHM0ogKEICAgICRwe6upgE%7CCgsIiJWxoQYQyKrweg%7C?hl=id,5,1680624264,04/04/2023 16:04:24,1,-4700165957985294422,119,72,93,248,612,5,Makan malam,Rp 1–25.000,5,4,Kedai Roti,,,Kesesuaian untuk anak-anak,,,,,,,
0x2e69ef54401682e3:0xbec5a7f6b8e727aa,Kedai Roti Ibu Saya,0x2e69ef54401682e3:0xbec5a7f6b8e727aa,ChIJ44IWQFTvaS4RqifnuPanxb4,"https://www.google.com/maps/place/Kedai+Roti+Ibu+Saya/@-6.3574689,106.77544479999999,14z/data=!4m8!1m2!2m1!1sKedai+Roti+Ibu+Saya!3m4!1s0x2e69ef54401682e3:0xbec5a7f6b8e727aa!8m2!3d-6.3574689!4d106.77544479999999",https://search.google.com/local/reviews?placeid=ChIJ44IWQFTvaS4RqifnuPanxb4&q=*&authuser=0&hl=id&gl=US,1144,4.0,ChdDSUhNMG9nS0VJQ0FnSUNOcXJMamlBRRAB,CAESY0NBRVFXQnBFUTJwRlNVRlNTWEJEWjI5QlVEZGZURUZVU0c1ZlgxOWZSV2hFU3pWdFVVUlJTV3hxWWs5amVubE1XVUZCUVVGQlIyZHVPVEpTTkVOamRuaGFkbkZyV1VGRFNVRQ==,https://www.google.com/maps/contrib/111960616180517833715?hl=id,Shera Septiana,111960616180517833715,https://lh3.googleusercontent.com/a-/ALV-UjXoXhZpqdxfbRPc2jsA2srgJu3tHWVw4WLNFNZzcWmiED3Ko8aaNg=s120-c-rp-mo-br100,12,1,Tmpt nya luas mau indoor atau outdoor bisa...harganya murah2 trjangkau bgt....roti bakar ma pizza nya mantulll.. pelayanan nya good...,https://lh5.googleusercontent.com/p/AF1QipNas7ssivLsIlcYSGZfKu_5iuoJ3dLkpvaRyHf4,https://lh5.googleusercontent.com/p/AF1QipNas7ssivLsIlcYSGZfKu_5iuoJ3dLkpvaRyHf4=w150-h150-k-no-p,AF1QipNas7ssivLsIlcYSGZfKu_5iuoJ3dLkpvaRyHf4,,,,https://www.google.com/maps/reviews/data=!4m8!14m7!1m6!2m5!1sChdDSUhNMG9nS0VJQ0FnSUNOcXJMamlBRRAB!2m1!1s0x0:0xbec5a7f6b8e727aa!3m1!1s2@1:CIHM0ogKEICAgICNqrLjiAE%7CCgwI6_OKrQYQiImbmwM%7C?hl=id,5,1705163243,01/13/2024 16:27:23,0,-4700165957985294422,119,72,93,248,612,5,Makan siang,Rp 1–25.000,5,5,Pizza Roti Coklat,,,,,,,,,,
0x2e69ef54401682e3:0xbec5a7f6b8e727aa,Kedai Roti Ibu Saya,0x2e69ef54401682e3:0xbec5a7f6b8e727aa,ChIJ44IWQFTvaS4RqifnuPanxb4,"https://www.google.com/maps/place/Kedai+Roti+Ibu+Saya/@-6.3574689,106.77544479999999,14z/data=!4m8!1m2!2m1!1sKedai+Roti+Ibu+Saya!3m4!1s0x2e69ef54401682e3:0xbec5a7f6b8e727aa!8m2!3d-6.3574689!4d106.77544479999999",https://search.google.com/local/reviews?placeid=ChIJ44IWQFTvaS4RqifnuPanxb4&q=*&authuser=0&hl=id&gl=US,1144,4.0,ChZDSUhNMG9nS0VJQ0FnSUNoMXEybmRBEAE,CAESY0NBRVFXUnBFUTJwRlNVRlNTWEJEWjI5QlVEZGZURUZVVDFOZlgxOWZSV2hEVkZZME1GaG9ZMmRrZFhRNGR6WlRRVUZCUVVGQlIyZHVPVEpTTkVObFluRkNTWEUwV1VGRFNVRQ==,https://www.google.com/maps/contrib/105936024435545030826?hl=id,Tita Amalia N R,105936024435545030826,https://lh3.googleusercontent.com/a-/ALV-UjWpqIV8zurCTvb5KFhXlhpk4vPMYoxDIOxNPr51x9CspDET-Yto=s120-c-rp-mo-br100,11,2,"ke kedai roti ibu saya grgr tiktok wkwk. tempatnya nyaman bgtt. suasananya di bkin kek jaman duluu. tempat parkirnya luas. makanannya enakk bgt, murah-murah start dr 5k-20k. yg pizza best seller bgt cuma minusnya cepet abis bbrp menu. saya saranin dteng jam 8/9. terus minusnya lagi layanan ny lamaa bgtt diantar makanannya tp it's okey terbayarkan bikin perut kenyang haha. rekomendasi bgt ni","https://lh5.googleusercontent.com/p/AF1QipM79vTEwwJGkJvJ62J166rvSQApcrsO_PnKGQFf, https://lh5.googleusercontent.com/p/AF1QipNMHY46hqfgXlfuxMyNL8gGrudODCSTJEtsmJAM, https://lh5.googleusercontent.com/p/AF1QipMBmIEbx5bvZDDAcGyx1AN2m5Rfs4xA2YWu6Z8b, https://lh5.googleusercontent.com/p/AF1QipM4NirhwtOek9orXgDVkrVFq1dOdxSsrBAcJEqV, https://lh5.googleusercontent.com/p/AF1QipM3XEtNLN-2BN4jmAPfYG5QG0nyENDvbvpYdzOC",https://lh5.googleusercontent.com/p/AF1QipM79vTEwwJGkJvJ62J166rvSQApcrsO_PnKGQFf=w150-h150-k-no-p,"AF1QipM79vTEwwJGkJvJ62J166rvSQApcrsO_PnKGQFf, AF1QipNMHY46hqfgXlfuxMyNL8gGrudODCSTJEtsmJAM, AF1QipMBmIEbx5bvZDDAcGyx1AN2m5Rfs4xA2YWu6Z8b, AF1QipM4NirhwtOek9orXgDVkrVFq1dOdxSsrBAcJEqV, AF1QipM3XEtNLN-2BN4jmAPfYG5QG0nyENDvbvpYdzOC",,,,https://www.google.com/maps/reviews/data=!4m8!14m7!1m6!2m5!1sChZDSUhNMG9nS0VJQ0FnSUNoMXEybmRBEAE!2m1!1s0x0:0xbec5a7f6b8e727aa!3m1!1s2@1:CIHM0ogKEICAgICh1q2ndA%7CCgwIs6mjnwYQ4Oe-gAI%7C?hl=id,5,1676203187,02/12/2023 11:59:47,0,-4700165957985294422,119,72,93,248,612,3,,,5,5,,,,,,,,,,,
0x2e69ef54401682e3:0xbec5a7f6b8e727aa,Kedai Roti Ibu Saya,0x2e69ef54401682e3:0xbec5a7f6b8e727aa,ChIJ44IWQFTvaS4RqifnuPanxb4,"https://www.google.com/maps/place/Kedai+Roti+Ibu+Saya/@-6.3574689,106.77544479999999,14z/data=!4m8!1m2!2m1!1sKedai+Roti+Ibu+Saya!3m4!1s0x2e69ef54401682e3:0xbec5a7f6b8e727aa!8m2!3d-6.3574689!4d106.77544479999999",https://search.google.com/local/reviews?placeid=ChIJ44IWQFTvaS4RqifnuPanxb4&q=*&authuser=0&hl=id&gl=US,1144,4.0,ChZDSUhNMG9nS0VJQ0FnSUNSX0pILWNnEAE,CAESY0NBRVFXaHBFUTJwRlNVRlNTWEJEWjI5QlVEZGZURUZWWTJkZlgxOWZSV2hEWVZGdlVtdFpTR3RmWWs1YVJtSklSVUZCUVVGQlIyZHVPVEpUUlVObFRtMUtRWEk0V1VGRFNVRQ==,https://www.google.com/maps/contrib/108212880303489193109?hl=id,Ratrira Shada R.,108212880303489193109,https://lh3.googleusercontent.com/a-/ALV-UjXGq8RRXs2mYQ7oTZbPRpIFrQn5Mbpnr2cjbSiEsZEUcO2EPu3a=s120-c-rp-mo-ba3-br100,15,1,"Aku sudah 2x kesini meskipun lokasinya jauh. Aku suka ambience nya, terlebih pagi dan sore dan yang pasti ketika sepi karena terasa adem dan tenang. I have no complaints with the food & drink, mengingat harganya yang sangaaaat terjangkau. Hanya sangat disayangkan pelayanannya bisa ku nilai 3 out of 10. Kenapa???
1. Kedai Roti Ibu Saya punya banyak waiters & waitresses yang tidak merata pembagian tugasnya atau mereka tidak saling back-up ketika sedang ramai pengunjung. Pada kunjungan ke 2 saya di sini saat weekend dan sedang ramai-ramainya, saya melihat sebagian SANGAT sibuk (ke meja sana sini untuk antar orderan, memastikan orderan sesuai dan selesai, bahkan sering menghampiri meja karena dipanggil oleh pelanggan yang komplain pesanannya belum datang), sebagian lagi SIBUK seperti biasa, dan ada beberapa yang MENYIBUKKAN DIRI di samping temannya yang lagi bekerja di kasir padahal antrian panjang & tidak ada inisiatif untuk bantu, cuma ngipas ngipas diri aja sambil buka Instagram (padahal saya sudah bolak-balik ke kasir 2x dan masih dengan kegiatan yg sama)
2. Saya pernah menunggu minuman HAMPIR 1 JAM TIDAK KUNJUNG DATANG, padahal makanan sudah habis:') Bilangnya sih waiting list, tapi pesanan baru sudah diantar... Waiting list atau lupa?
3. Ngobrol teruuuussss gerombolan ketawa ketiwi di saat jam kerja udah kayak lagi reunian (gak ada yang salah tapi tolong professional), sampe bingung mau minta bantuan gimana???
Semoga bisa lebih baik ya pelayanannya & coba deh owner kedai ini untuk briefing dan evaluasi sering-sering dengan kakak-kakak waiters nyaaa🙏🏻","https://lh5.googleusercontent.com/p/AF1QipOL0JboSuuA3H37r1wE_H_lUDmuGFRwcwG41_v7, https://lh5.googleusercontent.com/p/AF1QipPzedgOt_OkX06Qk024dZ93Pt-u1C9x5zMawszS",https://lh5.googleusercontent.com/p/AF1QipOL0JboSuuA3H37r1wE_H_lUDmuGFRwcwG41_v7=w150-h150-k-no-p,"AF1QipOL0JboSuuA3H37r1wE_H_lUDmuGFRwcwG41_v7, AF1QipPzedgOt_OkX06Qk024dZ93Pt-u1C9x5zMawszS",,,,https://www.google.com/maps/reviews/data=!4m8!14m7!1m6!2m5!1sChZDSUhNMG9nS0VJQ0FnSUNSX0pILWNnEAE!2m1!1s0x0:0xbec5a7f6b8e727aa!3m1!1s2@1:CIHM0ogKEICAgICR_JH-cg%7CCgsIydiJoQYQuO3pCw%7C?hl=id,4,1679977545,03/28/2023 04:25:45,15,-4700165957985294422,119,72,93,248,612,3,,Rp 1–25.000,4,5,,,,,,,,,,,
0x2e69ef54401682e3:0xbec5a7f6b8e727aa,Kedai Roti Ibu Saya,0x2e69ef54401682e3:0xbec5a7f6b8e727aa,ChIJ44IWQFTvaS4RqifnuPanxb4,"https://www.google.com/maps/place/Kedai+Roti+Ibu+Saya/@-6.3574689,106.77544479999999,14z/data=!4m8!1m2!2m1!1sKedai+Roti+Ibu+Saya!3m4!1s0x2e69ef54401682e3:0xbec5a7f6b8e727aa!8m2!3d-6.3574689!4d106.77544479999999",https://search.google.com/local/reviews?placeid=ChIJ44IWQFTvaS4RqifnuPanxb4&q=*&authuser=0&hl=id&gl=US,1144,4.0,ChZDSUhNMG9nS0VJQ0FnSURKbllYX0pREAE,CAESY0NBRVFXeHBFUTJwRlNVRlNTWEJEWjI5QlVEZGZURUZWY0hGZlgxOWZSV2hCVUUxdUxYVnRhV0o1UkhVdFYzZHlUVUZCUVVGQlIyZHVPVEpUUlVOa2Iwb3RPUzFyV1VGRFNVRQ==,https://www.google.com/maps/contrib/110762871589006176580?hl=id,gumilar rukmana,110762871589006176580,https://lh3.googleusercontent.com/a-/ALV-UjXLt1F43Q6Pgw8XgK2f6nKNBYyGp60ZYjohG8-SXe4_F9omHonQ9g=s120-c-rp-mo-ba3-br100,33,13,Harga makanan & minuman nya murah 🤩. Lumayan enak dgn harga segitu. Mungkin yg kurang tinggal tempat nya dibikin lebih bersih lagi plus musholla nya.,"https://lh5.googleusercontent.com/p/AF1QipNckhYE1N0_bpfUv-4G7BrTRDmMop_szzEaHocI, https://lh5.googleusercontent.com/p/AF1QipN0VChn8dAiIZx4izjS0QalMWzUEiYwNdBgvUL7, https://lh5.googleusercontent.com/p/AF1QipODTA3QRXN3jcefOpARLb7nsowPn3-bfNeo5oQt",https://lh5.googleusercontent.com/p/AF1QipNckhYE1N0_bpfUv-4G7BrTRDmMop_szzEaHocI=w150-h150-k-no-p,"AF1QipNckhYE1N0_bpfUv-4G7BrTRDmMop_szzEaHocI, AF1QipN0VChn8dAiIZx4izjS0QalMWzUEiYwNdBgvUL7, AF1QipODTA3QRXN3jcefOpARLb7nsowPn3-bfNeo5oQt",,,,https://www.google.com/maps/reviews/data=!4m8!14m7!1m6!2m5!1sChZDSUhNMG9nS0VJQ0FnSURKbllYX0pREAE!2m1!1s0x0:0xbec5a7f6b8e727aa!3m1!1s2@1:CIHM0ogKEICAgIDJnYX_JQ%7CCgwI643vpQYQqIXRggI%7C?hl=id,4,1690027755,07/22/2023 12:09:15,0,-4700165957985294422,119,72,93,248,612,4,,,4,4,,,,,,,,,,,
0x2e69ef54401682e3:0xbec5a7f6b8e727aa,Kedai Roti Ibu Saya,0x2e69ef54401682e3:0xbec5a7f6b8e727aa,ChIJ44IWQFTvaS4RqifnuPanxb4,"https://www.google.com/maps/place/Kedai+Roti+Ibu+Saya/@-6.3574689,106.77544479999999,14z/data=!4m8!1m2!2m1!1sKedai+Roti+Ibu+Saya!3m4!1s0x2e69ef54401682e3:0xbec5a7f6b8e727aa!8m2!3d-6.3574689!4d106.77544479999999",https://search.google.com/local/reviews?placeid=ChIJ44IWQFTvaS4RqifnuPanxb4&q=*&authuser=0&hl=id&gl=US,1144,4.0,ChRDSUhNMG9nS0VJQ0FnSUNScWRaZBAB,CAESY0NBRVFYQnBFUTJwRlNVRlNTWEJEWjI5QlVEZGZURUZWTWs5ZlgxOWZSV2hEYWpGbWIxSnRVWFl0YUd4dVIwNXVXVUZCUVVGQlIyZHVPVEpUU1VObFMxOHlTMnhuV1VGRFNVRQ==,https://www.google.com/maps/contrib/101836428920909137152?hl=id,20_Yenni Karenita,101836428920909137152,https://lh3.googleusercontent.com/a-/ALV-UjXUxZTmPkgE7oYn2SGIhMEaMQKvDcx5NNUYfQIRdrWwnl4XUEhE=s120-c-rp-mo-br100,7,0,"murah, pelayangan better lah ya soalnya ini kali kedua makan disini. waktu pertama kali tuh meja full. dan waktu itu gak di bantu cariin meja sm karyawan nya. malah kita dibiarin pergi gitu ajaa. tapi anehnya saya koo balik lagi karena jujur penasaran sama makanannya. pesen mie apa ya lupa namanya, itu gaenak bgt soalnya cuma bener2 kuah ajaaa, mie nya sedikit bgt dan malah hambar rasanya. klo take away juga packaging nya nambah lagi 2rban. disini minim colokan untuk chrgr yaa(gatau klo di dalam). jd untuk yg niatnya mau nugas atau kerja dgn laptop disini, harus pikir 2x.. tp worth it sih roti rotinyaa","https://lh5.googleusercontent.com/p/AF1QipNPWqRh7mMs_J6bkt6RMefAHsCPv24K03oaQYDS, https://lh5.googleusercontent.com/p/AF1QipPr4kTPINcDyKhIxOSodHqDG_0sEVqIp2K7iGMb",https://lh5.googleusercontent.com/p/AF1QipNPWqRh7mMs_J6bkt6RMefAHsCPv24K03oaQYDS=w150-h150-k-no-p,"AF1QipNPWqRh7mMs_J6bkt6RMefAHsCPv24K03oaQYDS, AF1QipPr4kTPINcDyKhIxOSodHqDG_0sEVqIp2K7iGMb",,,,https://www.google.com/maps/reviews/data=!4m8!14m7!1m6!2m5!1sChRDSUhNMG9nS0VJQ0FnSUNScWRaZBAB!2m1!1s0x0:0xbec5a7f6b8e727aa!3m1!1s2@1:CIHM0ogKEICAgICRqdZd%7CCgwI2qG0oQYQqKSm_wE%7C?hl=id,4,1680675034,04/05/2023 06:10:34,0,-4700165957985294422,119,72,93,248,612,3,,,3,3,,,,,,,,,,,
